{
  "nonDeductableLoanInterest": {
    "customerReference": "myref",
    "reliefClaimed": 763.00
  },
  "payrollGiving": {
    "customerReference": "myref",
    "reliefClaimed": 154.00
  },
  "qualifyingDistributionRedemptionOfSharesAndSecurities": {
    "customerReference": "myref",
    "amount": 222.22
  },
  "maintenancePayments": [
    {
      "customerReference": "myref",
      "exSpouseName" : "Hilda",
      "exSpouseDateOfBirth": "2000-01-01",
      "amount": 222.22
    }
  ],
  "postCessationTradeReliefAndCertainOtherLosses": [
    {
      "customerReference": "myref",
      "businessName": "ACME Inc",
      "dateBusinessCeased": "2019-08-10",
      "natureOfTrade": "Widgets Manufacturer",
      "incomeSource": "AB12412/A12",
      "amount": 222.22
    }
  ],
  "annualPaymentsMade": {
    "customerReference": "myref",
    "reliefClaimed": 763.00
  },
  "qualifyingLoanInterestPayments": [
    {
      "customerReference": "myref",
      "lenderName": "Maurice",
      "reliefClaimed": 763.00
    }
  ]
}